{"baselineObservation":{"occurrenceCount":205,"referenceSetSha256":"70ccf154c4b9ebdc108d1bdcab140343d7f3c0429a0459a6a05da62705001178","trackedReferenceCount":110},"claimBoundary":{"provesBehavior":false,"provesCrossHostPortability":false,"provesCurrentSelectorActivation":false,"provesLiveMigration":false,"provesOverallHarnessCompletion":false,"provesProductionReadiness":false,"provesReleaseEligibility":false,"provesValue":false},"date":"2026-08-10","id":"program-acceptance-authority-v2-migration-inventory-2026-08-10","occurrences":[{"candidateBinding":"rehearsal-selector","classification":"B-current-authority-consumer","currentBinding":"legacy-v1","line":150,"lineSha256":"53317db0c6735557c853ce496e0f12035f1da88326c1695ad834b4562f6f3ca7","liveMigrationAction":"separate-authority","path":"README.md","patternId":"legacy-acceptance-path","purpose":"current","rehearsalAction":"selector","rollbackAction":"receipt","separateAuthorizationRequired":true,"verificationSurface":"exact-set"},{"candidateBinding":"rehearsal-selector","classification":"B-current-authority-consumer","currentBinding":"legacy-v1","line":123,"lineSha256":"582e0b92c3e2de325c635b636d0c437e457bb313ca13f149953c4f8ad5ce7afb","liveMigrationAction":"separate-authority","path":"README.zh-CN.md","patternId":"legacy-acceptance-path","purpose":"current","rehearsalAction":"selector","rollbackAction":"receipt","separateAuthorizationRequired":true,"verificationSurface":"exact-set"},{"candidateBinding":"rehearsal-selector","classification":"B-current-authority-consumer","currentBinding":"legacy-v1","line":11,"lineSha256":"dba5e8187307c95b98943f8b24d21ea458e551f0cd0bc9c9a8abdccd79d97a16","liveMigrationAction":"separate-authority","path":"docs/curation-program-plan.md","patternId":"legacy-acceptance-path","purpose":"current","rehearsalAction":"selector","rollbackAction":"receipt","separateAuthorizationRequired":true,"verificationSurface":"exact-set"},{"candidateBinding":"rehearsal-selector","classification":"B-current-authority-consumer","currentBinding":"legacy-v1","line":127,"lineSha256":"c44a1bdf6e84aef0072df1507dcb54836802c76855a1b21b32b6ecd47032fb83","liveMigrationAction":"separate-authority","path":"docs/curation-program-plan.md","patternId":"legacy-acceptance-path","purpose":"current","rehearsalAction":"selector","rollbackAction":"receipt","separateAuthorizationRequired":true,"verificationSurface":"exact-set"},{"candidateBinding":"preserve-legacy-v1","classification":"A-immutable-historical","currentBinding":"legacy-v1","line":19,"lineSha256":"29c60671972a2d67d18cb26cabc4912098e26cb129ffcd53b05781967362ab5c","liveMigrationAction":"no-repoint","path":"docs/program-control-plan-completeness-audit-2026-07-15.md","patternId":"legacy-acceptance-path","purpose":"historical","rehearsalAction":"preserve","rollbackAction":"retain","separateAuthorizationRequired":false,"verificationSurface":"exact-set"},{"candidateBinding":"preserve-legacy-v1","classification":"A-immutable-historical","currentBinding":"legacy-v1","line":20,"lineSha256":"29c60671972a2d67d18cb26cabc4912098e26cb129ffcd53b05781967362ab5c","liveMigrationAction":"no-repoint","path":"docs/program-order-semantics-audit-2026-07-15.md","patternId":"legacy-acceptance-path","purpose":"historical","rehearsalAction":"preserve","rollbackAction":"retain","separateAuthorizationRequired":false,"verificationSurface":"exact-set"},{"candidateBinding":"preserve-legacy-v1","classification":"A-immutable-historical","currentBinding":"legacy-v1","line":9,"lineSha256":"5891638d4827d331dd8816557cfafafe1b5b427b05f345172e87a41e2dd86664","liveMigrationAction":"no-repoint","path":"docs/superpowers/plans/2026-07-15-production-capability-manager-topology-gate.md","patternId":"legacy-acceptance-path","purpose":"historical","rehearsalAction":"preserve","rollbackAction":"retain","separateAuthorizationRequired":false,"verificationSurface":"exact-set"},{"candidateBinding":"preserve-legacy-v1","classification":"A-immutable-historical","currentBinding":"legacy-v1","line":31,"lineSha256":"ed18066aaaa2819aab8429938b262a5afeb693cb7c8a340d936758aef08ee7d0","liveMigrationAction":"no-repoint","path":"docs/superpowers/plans/2026-07-15-production-capability-manager-topology-gate.md","patternId":"legacy-acceptance-path","purpose":"historical","rehearsalAction":"preserve","rollbackAction":"retain","separateAuthorizationRequired":false,"verificationSurface":"exact-set"},{"candidateBinding":"preserve-legacy-v1","classification":"A-immutable-historical","currentBinding":"legacy-v1","line":91,"lineSha256":"ed18066aaaa2819aab8429938b262a5afeb693cb7c8a340d936758aef08ee7d0","liveMigrationAction":"no-repoint","path":"docs/superpowers/plans/2026-07-15-production-capability-manager-topology-gate.md","patternId":"legacy-acceptance-path","purpose":"historical","rehearsalAction":"preserve","rollbackAction":"retain","separateAuthorizationRequired":false,"verificationSurface":"exact-set"},{"candidateBinding":"preserve-legacy-v1","classification":"A-immutable-historical","currentBinding":"legacy-v1","line":149,"lineSha256":"ed18066aaaa2819aab8429938b262a5afeb693cb7c8a340d936758aef08ee7d0","liveMigrationAction":"no-repoint","path":"docs/superpowers/plans/2026-07-15-production-capability-manager-topology-gate.md","patternId":"legacy-acceptance-path","purpose":"historical","rehearsalAction":"preserve","rollbackAction":"retain","separateAuthorizationRequired":false,"verificationSurface":"exact-set"},{"candidateBinding":"preserve-legacy-v1","classification":"A-immutable-historical","currentBinding":"legacy-v1","line":7,"lineSha256":"7f5554833eb22d8e70d0b78c661caca6be8b54004578a311d4cf8fc21f524c75","liveMigrationAction":"no-repoint","path":"docs/superpowers/plans/2026-07-15-program-baseline-acceptance-mapping.md","patternId":"legacy-acceptance-path","purpose":"historical","rehearsalAction":"preserve","rollbackAction":"retain","separateAuthorizationRequired":false,"verificationSurface":"exact-set"},{"candidateBinding":"preserve-legacy-v1","classification":"A-immutable-historical","currentBinding":"legacy-v1","line":34,"lineSha256":"31a45db86976738578e256ce029ccffd124c0d37a40f581539b310caad85abdb","liveMigrationAction":"no-repoint","path":"docs/superpowers/plans/2026-07-15-program-baseline-acceptance-mapping.md","patternId":"legacy-acceptance-path","purpose":"historical","rehearsalAction":"preserve","rollbackAction":"retain","separateAuthorizationRequired":false,"verificationSurface":"exact-set"},{"candidateBinding":"preserve-legacy-v1","classification":"A-immutable-historical","currentBinding":"legacy-v1","line":41,"lineSha256":"cbb2ec6fc05640e3a572312c564d16aec33cdd2002a9e32b1d7de20c1a49404e","liveMigrationAction":"no-repoint","path":"docs/superpowers/plans/2026-07-15-program-baseline-acceptance-mapping.md","patternId":"legacy-acceptance-path","purpose":"historical","rehearsalAction":"preserve","rollbackAction":"retain","separateAuthorizationRequired":false,"verificationSurface":"exact-set"},{"candidateBinding":"preserve-legacy-v1","classification":"A-immutable-historical","currentBinding":"legacy-v1","line":50,"lineSha256":"db4aa47d3e60ef67907dc8e5f3ae858ad2680914f31032b4d95f0a62b6bd7806","liveMigrationAction":"no-repoint","path":"docs/superpowers/plans/2026-07-15-program-baseline-acceptance-mapping.md","patternId":"legacy-acceptance-path","purpose":"historical","rehearsalAction":"preserve","rollbackAction":"retain","separateAuthorizationRequired":false,"verificationSurface":"exact-set"},{"candidateBinding":"preserve-legacy-v1","classification":"A-immutable-historical","currentBinding":"legacy-v1","line":60,"lineSha256":"db4aa47d3e60ef67907dc8e5f3ae858ad2680914f31032b4d95f0a62b6bd7806","liveMigrationAction":"no-repoint","path":"docs/superpowers/plans/2026-07-15-program-baseline-acceptance-mapping.md","patternId":"legacy-acceptance-path","purpose":"historical","rehearsalAction":"preserve","rollbackAction":"retain","separateAuthorizationRequired":false,"verificationSurface":"exact-set"},{"candidateBinding":"preserve-legacy-v1","classification":"A-immutable-historical","currentBinding":"legacy-v1","line":101,"lineSha256":"b092adcbc84a71792e98ac6d90ab672c64ae5ecf6b2bc46b7609ad73131878eb","liveMigrationAction":"no-repoint","path":"docs/superpowers/plans/2026-07-15-program-baseline-acceptance-mapping.md","patternId":"legacy-acceptance-path","purpose":"historical","rehearsalAction":"preserve","rollbackAction":"retain","separateAuthorizationRequired":false,"verificationSurface":"exact-set"},{"candidateBinding":"preserve-legacy-v1","classification":"A-immutable-historical","currentBinding":"legacy-v1","line":229,"lineSha256":"4fd1ef98d1535f2991cabd6c2175ea0d174c5df7689f2e8412e42d3b5d1fc5a9","liveMigrationAction":"no-repoint","path":"docs/superpowers/plans/2026-07-15-program-baseline-acceptance-mapping.md","patternId":"legacy-acceptance-path","purpose":"historical","rehearsalAction":"preserve","rollbackAction":"retain","separateAuthorizationRequired":false,"verificationSurface":"exact-set"},{"candidateBinding":"preserve-legacy-v1","classification":"A-immutable-historical","currentBinding":"legacy-v1","line":255,"lineSha256":"804c6f457838090872c936b99fe23d53db0478da3a3258e408288845e40e0cac","liveMigrationAction":"no-repoint","path":"docs/superpowers/plans/2026-07-15-program-baseline-acceptance-mapping.md","patternId":"legacy-acceptance-path","purpose":"historical","rehearsalAction":"preserve","rollbackAction":"retain","separateAuthorizationRequired":false,"verificationSurface":"exact-set"},{"candidateBinding":"preserve-legacy-v1","classification":"A-immutable-historical","currentBinding":"legacy-v1","line":262,"lineSha256":"d60216ef8ed028ab3805cfc56b2c1967e9dcdc5481c08e19f85311b2222f59ca","liveMigrationAction":"no-repoint","path":"docs/superpowers/plans/2026-07-15-program-baseline-acceptance-mapping.md","patternId":"legacy-acceptance-id","purpose":"historical","rehearsalAction":"preserve","rollbackAction":"retain","separateAuthorizationRequired":false,"verificationSurface":"exact